"cluster","sampleText","num_transcripts"
646,"senator john mccain made a dramatic return to washington made a dramatic return to washington today after a brain cancer diagnosis washington today after a brain cancer diagnosis and cast a decisive vote that opens debate on repealing and replacing obamacare mister mccain - aye his vote today - crucial - for his party to move forward with health care mccain delivering a passionate message for his colleagues sot sen john mccain arizona 19-32 what have we to lose by trying to work together to find those solutions we're not getting done much apart i don't think any of us feels very proud of our incapacity today's vote was 50 for 50 against with vice-president mike pence breaking the tie in favor of",1
647,"three weeks since police say she watched her mother stab to death her father and four siblings nefertiti jaquez reports diana romero is your typical 9-year-old girl who likes playing with her friends and cousins diana romero survived family i like to do art and i like doing bracelets and i'm always creative so being back home with her family makes",1
648,"home with her family makes the 9-year-old truly happy diana romero survived family not lonely she tells us it also makes her feel free that's because diana has spent the last two weeks in the hospital in the icu in spanish her uncle tell us this has been an extremely difficult time for his family but",1
650,"a bill we know that the debate could eliminate health insurance coverage for more than half 1 million arizonans the republicans have looked for a way to replace it without paying a terrible political price we haven't found it yet i'm not sure we will",1
651,"patrick community church filled with hundreds has close family stayed close behind to bury their loved ones an emotional day on the floor of the u s senate when senator john mccain fresh off the surgery that led to his cancer diagnosis brought republicans and democrats to their feet in a thundering ovation just 11 days after brain surgery the scar is still fresh over john mccain zi the senator delivered a powerful wake-up call to a dysfunctional congress stop listening to the bombastic loudmouths on the radio television and the internet to hell with them we are getting nothing done my friends we are getting nothing done just hours after senator mccain's crucial vote to allow debate on a repeal of obamacare the replacement plan presented by republicans fell short of the votes needed lt or not we are of the same party we are not the presidents subordinates -- the president's subordinates we are his equal mccains speech didn't ultimately change anything the senate voted down a republican proposal to repeal and replace",1
652,"die his mother appeared before a judge in london yesterday the family gave up its legal bat toll give their son an experimental treatment in the united states now they want their son to spend his final hours with them at home hospital said it would like to fulfill the parents' wishes but must also take the baby's best interests into account he has a rare genetic condition and will die once",1
657,"garcia has more on the ball and what comes next republicans need of 50 votes today and they got him the senate voted to move forward and begin debate on the health care bill that passed the house came down to our tie-breaking vote the senate being equally divided vice president votes in the affirmative and the motion is agreed to senate republicans are moving forward with their",1
658,"to washington today following his diagnosis of brain cancer kane's arrival on the state afford it was met with applause on both sides of the aisle after casting his yes vote butter mccain delivered passionate remarks urging bipartisanship that's an approach that's been employed by both sides mandating registration from the top down without any support from the other side went all the maneuvers that required we are getting nothing done my friends we are getting nothing done what comes next gets complicated senators will vote on several amendments",1
659,"several amendments those trip the house healthcare bang language and clean the 2015 repeal bill on the other at a pennsylvania avenue pressure is mounting for president trump called today's vote of big step the motion to proceed on healthcare has just passed and now we move forward towards truly great healthcare",1
660,"what will this bill fill look like when they get done with this native 50 votes today they got on the senate voted to move forward and begin debate on the health care bill and came down to a tie-breaking vote from vice president mike pence shortly after the dramatic return of senator john mccain the senate be equally divided vice president boats in the affirmative and the motion is",1
661,"casting his yes vote senator mccain delivered passionate remarks purging bipartisan we been spending our wheels an important issues we're trying to find a way to win at that help from across the aisle that a been both sides mandating registration from top down without any support from the other side with all the maneuvers that require we are getting nothing done my friends we are getting nothing done what comes next gets complicated sanders will vote on several amendments that would strip the house health care bill language including the 2015 repeal bill on the other end of pennsylvania avenue pressure is mounting from president trump who",1
662,"promising not to give up on obama care we lost an important battle today all to cast his critical votes my service here is the most important job i've had in my life was not all healthcare health leaders overwhelmingly passed a bill approving new sanctions against russia and north korea an ironic is the president son-in-law returns for second day to answer questions about rush on capitol hill we appreciate is voluntary willingness to come and testify today",1
663,"crime where our e-mails and dmc server and intel lakers a long time trump supporter was a first side to support the trump campaign i am pleased to endorse the president of the united states now it seems sessions his job is in jeopardy time will tell the president's opinion of it attorney general seems to have flowers and marge after sessions recused himself from the russian investigation he should not have recused himself almost immediately after he took office and if he is going to recuse himself show told me prior to taking office and i would've quite simply",1
664,"show a roughly 8- percent increase in hikers carrying bear spray last year but there is still room for improvement coming down to the last minute now g-o-p members will move forward to decide what exactly an obamacare repeal will look like",1
666,"birth certificate data from about 200 thousand births between 2010 and 2013 about 37 hundred of those were home births people are being urged to keep themselves and their animals out of the long tom and mountain home reservoirs in elmcoafter blue-green algae was found in the water state agencies have issued a health advisory for both reservoirs blue algae can produce dangerous toxins and be harmful to people pets and livestock those with liver or kidney damage are at an increased risk of illness",1
667,"last winter experts say that's not catastrophic in 2015 and 2016 survival rates were very high we have a wiener stubby racing dog baby bo took home the title of the fastest wiener in the west",1
668,"the world of horse riding through the douglas county four h 2 you're watching fox 21 news at nine nikki the house is scheduled to vote on a bill that would impose more sanctions on russia-- iran and north korea dan but it would also limit president trump's powers to remove them all this -- as the u-s navy fires warning shots at",1
669,"if they had any persons of police would not say if they had any persons of interest in this case inaction will do nothing to solve obamacare's problems or bring relief to those who need it butted to this is the most dangerous and destructive piece of legislation ever to be discussed on the floor of the senate in the modern history of our country lawmakers are reacting tonight after the senate agreed to debate on the repeal and replacement of the affordable care act the senate voted to proceed by one vote today -- with vice president mike pence cast the tie- breaker it means the senate will now start debating a bill that would repeal the",1
671,"revealing last week he's battling brain cancer cheering the senate voting 50 to 50 -- ultimately deciding to move forward after vice president mike pence cast a tie breaking vote it means they now move on to debate the repeal -- and possible replacement -- of president obama's signature healthcare law our constituents are hurting under obamacare they are counting on us to do the right thing right now that means voting to allow the senate to finally move beyond obamacare's failures there are still a lot of uncertainties as to what the final health care measure will look like senator mcconnell has indicated he's open to exploring amendments",1
672,"while the senate voted on healthcare -- the house of represetatives decided to impose sanctions on russia the vote was a rare bipartisian moment on capitol hill lawmakers from both sides of the aisle agreed to slap sanctions on russia north korea and iran in the case of russia the sanctions are meant tothe country for interferring in the 2016 presidential election joaquin castro d - texas these sanctions are a clear signal that the united states will hold president putin and his close associates accountable for their actions they are also a declaration that congress can and will act even when president trump refuses to do so on their state run news agency - a russian spokesperson has said that moscow views the sanctions as highly negative",1
677,"problem with his attorney general and what it could mean if he's fired cb17bu5t30 asd4 slaascbsbula30cb17bu5t30 17d45t cbs s scb president trump has refused to sign off on a plan to send more troops to afghanistan trump sent a plan calling for a modest number of more troops back to his national security adviser last week when president trump was asked about sending more troops he said we'll see u s army soldier pictured kissing the isis flag pleaded not guilty to supporting the jihadist group court documents claim he met with undercover",1
678,"a central california teenager crashed her car killing her sister and live streamed it online that's after the weather i voted for the motion to proceed to allow debate to continue and amendments to be offered i will not vote for this bill as it is today it's a shell of a bill right now we all know that but first the senate votes to begin the healthcare debate as lawmakers on both sides of the aisle",1
679,"extraordinary public pressure to get jeff sessions to resign abc's chief white house correspondent jonathan karl leading us off today in the rose garden the president refused to say whether he would fire his attorney general i'm very disappointed with the attorney general but we will see what happens",1
680,"enamel is the white outer layer of your tooth surface the more that we can strengthen and re-harden that tooth surface the whiter their patients' teeth e going to be dentists are going to really want to recommend e new pronameltrg ight it's going to give their patients whiter teeth thank you for barging in like that yes and if you need anything ever work it out yourself",1
681,"not guilty a federal grand jury indicted ikaika kang on four counts of attempt to provide material support or resources to a foreign terrorist organization the indictment claims that on four separate occasions-- kang tried to provide classified military documents a drone military clothing and gear-- as well as combat and firearms training to the terror group the soldier appeared in court on monday morning and his attorney says what happened was to be expected we pled not guilty to the charges and a trial date has been set we'll be preparing our defense kang remains in custody at a federal prison his trial is set for september",1
682,"be more difficult senator john mcca made his return to the capital t with a warning for his fellow republicans will not vote for this bill as it is today its a shell of the bill right now we all know that gop leaders need nearly everyeln senator on board with the bill becau they only hold a slim majority it will certainly ne drast cuts n make a huge tax cuts for the rich no help for those with preexisting conditios to republican senators joined democrats in voting no todays vote kicked off the weeks long healthcare b as moderate and conservative republicans are at odds over an obamacare replacement",1
683,"later one person who survived gave details to the police people began hitting the trailer walls and making noise to get the drivers attention the driver never stopped as the air around them grew hotter the people inside used a hole in the trailer wall for ventilation taking turns breathing from the hole",1
684,"navy says the action forced after unsafe encounter in the persian gulf new developments in a case against an american soldier accused of trying to provide support to isis the soldier is pleading not guilty against the charges ikaika kang is charged with four counts of attempt to provide material support or resources to designated foreign terrorist organization the indictment claims that on four separate occasions-- kang tried to provide classified military documents a drone military clothing and gear to isis he's also accused of providing combat and firearms training to the terror group kang remains in custody at a federal prison his trial has been set for september 19th two u-s defense officials say a u-s navy ship fired warning shots at an armed iranian patrol boat in the northern persian gulf according to the officials the iranian boat came within 150 yards of the u-s-s thunderbolt the iranians did not respond to any warnings from the u-s ship including radio calls firing of flares and five",1
685,"who are detained there one of the people thought to be imprisoned there -- is former fbi agent robert levinson levinson went missing in 2007 while traveling to kish island in iran he had been hired as a c-i-a contractor the year before but the white house says he was not a government employee when he disappeared levinson's son --- dan -- says it will take a lot of work and plenty of pressure",1
686,"of pressure for iran to release his father dan levinson son of american held hostage in this more strongly- worded statement comes with the sticks that need to accompany the carrots when it comes to dealing with iran they only respond to pressure we've learned this over 10 years we're going to pressure our government to",1
687,"movement by calling the white house veterans hotline before the briefing and contacting members of congress lee stephania 2-shot lee a big day on capitol hill as the senate votes to open debate on repealing and replacing obamacare turn steph full stephania almost as major as the vote was senator john mccain's dramatic return to d-c after he was diagnosed with brain cancer",1
688,"brain cancer sot mccain's vote was crucial for republicans to move forward the final vote was even at 50 50 vice president pence broke the tie in republicans' favor after voting yes mccain urged his colleagues to work together sot sen john mccain r let's trust each other let's return to regular order we've been spinning our wheels on too many important issues because we keep trying to find a way to win without help from across the aisle",1
689,"will vote in favor to open up debate on repealing replacing obama care he released this statement today obama care isn't the answer but doing nothing to try to solve the problem it is creating isn't the answer either that is why i will vote to move forward and give us a chance to address the unworkable aspects of the law that have left many particularly those living in rural areas",1
690,"of the bill is not an improvement for the state he will not support it back to you president donald trump is keeping up his attacks on jeff sessions yesterday he referred to sessions as beleaguered in a tweet he took and wrote jeff sessions has taken a very weak position and hillary clinton crimes where our emails and dnc server and intel leakers at the white house he explained why he is disappointed in sessions he should not have increased himself -- recused himself after taking office if he was going to do so we should have told me prior to taking office",1
691,"senate intelligence committee lasted than three hours his thank you as he left the interview included ignoring questions from reporters the interview focused on russian interference in the election today's decision was under oath and conducted by members of congress the senate judiciary committee issued a subpoena for former trump campaign manager paul manafort chairman chuck grassley and diane feinstein issued the subpoena that requests he testify at a public hearing tomorrow they want paul manafort to testify about the enforcement of a foreign agents registration act and russia's meddling in last year's presidential election",1
695,"a former trump advisor provides his commentary on the democrats new agenda and the possibility for some bipartisan support problem we all have them the first step to dealing with the problem is admitting that it exists it seems that the democrats are taking the first step when you lose an election by someone that has a 40 popularity then you look in the mirror and see what you did wrong the more -- the number one thing that we did wrong is",1
696,"proposals for democrats that would create new jobs lower prescription drug prices setting new and tougher standards for corporate mergers actually the trump administration is already working on some of them last month president donald trump signed an executive order to increase the number of apprenticeships in the united states",1
697,"in the united states slogans are great but democrats now need to connect to the american people by action and not words movement on agenda items where the democrats actually agree with the white house would be a good start some parts of the",1
698,"you would like to comment on this segment then you can visit our website to give us your thoughts to officials say a u s navy ship fired warning shots at an armed iranian patrol boat it was said that the iranian boat came within 150 yards of the u s ship they did not respond to any warnings from the u s navy ship so the navy ship then fired warning shots into the water as they were concerned about a possibility of a collision the iranian ship",1
699,"live in sun valley gop members are moving forward to decide exactly what an obama repeal will look like vice president mike pence broke the tie officially opening the healthcare debate before the don't -- before the votes were cast senator john mccain made a dramatic return to washington battling brain cancer made a passionate plea for congress to put aside partisanship and help the american people",1
700,"senator voted against it while republican senator jeff gillan has been skeptical of previous versions but today he voted yes in favor of moving forward with talks to repeal and replace the affordable care act senator dean heller release the statement earlier today obamacare isn't the answer but doing nothing to try to solve the problems it has created isn't the answer either that is why i will vote to move forward and give us a chance to address the unworkable aspects of the law that have left many nevadans particularly those living in rural areas",1
701,"parking lot it happen yesterday between sacramento and san francisco a reporter has more details tonight surveillance video shows a man pulling into a strip mall he is therefore couple of minutes before he gets out of the car and pulls a baby carrier from the backseat he drops the car seat before he gets back into the",1
702,"pulled out and rushed out his cameras caught it from the shop i have never seen that in my life someone told him the car seat was in the parking lot he didn't believe it at first so he walked out site i did notice that there was a small baby inside",1
703,"seem to be whimpering but seemed well taken care of wrapped up in a blanket had a diaper on top and he appeared to be fine maybe his tongue was a little white like he had a bottle recently the man seen in the video is 18-year-old daniel stephen mitchell the baby's f the child is only 16 days old they say after abandoning the child mitchell crashes car in fairfield he was taken to the hospital for treatment the fire department is less than one mile away needing many to wonder why the baby wasn't dropped off here this is a designated safe surrender site but can only be confidentially dropped off without fear prosecution within 72 hours of birth",1
704,"ways to improve public safety at the transit center pam another big story tonight the u s senate has just blocked a wide- ranging proposal by republicans to repeal much of obamacare and replace it with a more restrictive plan the senators voted 57-43 this evening to reject the plan in the first vote on an amendment to the bill those voting no included nine defecting republicans the",1
705,"working poor people with jobs but still unable to stay out of poverty more than 14-hundred people volunteer every year senate republicans are moving forward with their attempt to replace obamacare the senate passed a motion this afternoon 51 to 50 to begin debate on the house-passed health care bill majority leader mitch mcconnell implored fellow republicans to vote yes while democrats remained united in their opposition our constituents are hurting under obamacare - they are counting on us to do the right thing now it will certainly mean drastic cuts in medicaid tax cuts for rich no help for people with pre-existing conditions the vote comes during the dramatic return of republican senator john mccain who traveled back to washington after being diagnosed with brain cancer a good day on wall street the dow closing up 100 points the nasdaq",1
706,"can go to receive treatment it also gives the u-n-m cancer center access to more clinical trials for blood disorders the senate is moving ahead with debate on an obamacare overhaul after a tie-breaking vote from vice president mike pence senator john mccain returned from arizona where he s being treated for brain cancer he cast a necessary republican vote for the motion after two g-o-p senators susan collins and lisa murkowski sided with all democrats in opposition the next step is floor debate on the legislation to overhaul the affordable care act even though there aren t any guarantees the votes are there to eventually pass it it s unclear what a final bill will look like",1
708,"manufacturing plant may have chosen another state besides texas and some american workers may walk off the job this week jane king is at the nasdaq with those stories and more in business report hello texasyou may not have heard of foxconn but you've likely come into contact with one of its products the chinese company makes much of the iphone and also led screens it wants to set up shop in the u-s for the first time and street journal says the company has chosen wisconsin over texas the foxconn plant would bring at least 5-thousand jobs",1
709,"i'm jane king with your report from the nasdaq marketsite in times square i'm jane king with your report kristen the senate voted to move forward on health care reform with a dramatic vote this afternoon a motion to begin debate on the house- passed health care bill required vice president mike pence to cast the tie-breaking vote after the senate split 50 to 50 50 of the 52 senate republicans supported beginning debate and as expected no democrats supported the motion the vote sat in limbo until senator john mccain's dramatic arrival in the chamber gave the g-o-p the 50th vote they needed it's a key moment in the republicans' seven-year campaign to repeal and replace obamacare",1
710,"obamacare kristen this family was vacationing in wisconsin for the 4th of july they were just sitting on a porch when the mom spotted a tick on her baby and as amanda gilbert explains the family now wants to warn others to let this be a wake up call something a loving mom didn't see coming for two- month old jett july hasn't been easy nat of him crying he was outside on the porch with his brothers",1
712,"of driving a school bus the school district has trainers on site to answer any questions participants might have --emily-- senate republicans have jumped over the first hurdle to advance their healthcare bill helathcare debate begins the chamber held a vote today to start a debate on the legislation vice president mike pence ended up breaking the senate tie lawmakers could strike a deal to repeal and replace obamacare they could vote for a straight repeal or they could pass what's being called a skinny repeal - a bill that strips out some of the major aspects of obamacare but leaves many of the provisions in place --emily-- meanwhile the house of representatives overwhelmingly passed the russian sanctions bill today 419 to three the plan also includes new sanctions against iran and north korea -- and it gives congress the power to block any effort by the white house to weaken sanctions on russia the senate still needs to approve the plan",1
715,"is hungry the nation's recent stance on immigration also plays a factor the asylum days are not always wide open the showdown over healthcare playing out over the senate floor senate republicans in a last ditch effort to repeal or replace obamacare john mccain returning to washington to cast his vote all we've managed to do is make more popular a policy that wasn't very popular when we started trying to get rid of it",1
