"cluster","sampleText","num_transcripts"
913,"director anthony scaramucci made no apologies for the president's statements acknowledging that president trump probably wants sessions to step aside i have an enormous amount of respect for the attorney general but i do know the president pretty well and if there's this level of tension in the relationship that",2
917,"years i hope my colleagues will honor their promise and vote with me for the 201017 repeal bill new tonight congress has rescinded its subpoena for former trump campaign official paul manafort to testify on russian meddling the senate judiciarcommittee says manafort is providing documents to 7 repeal bill anwhile pres the senate judiciary committee says manafort is providing documents to lawmakers",2
923,"to break the tie he's confident that a change in health care is coming this is about improving health care improving access making sure that people have health care coverage and access to health care so we've got to take some of the fear out of the process and recognize it's a multi-step process and we're going to work hard to",2
924,"up for late- night ride- thrus they're offering a new service that will allow users of the lyft ride- sharing app to add a taco bell stop to their ride with the click of a button lyft says the first-of-its- kind-offering called taco mode is an in- app option that includes a free doritos locos taco when you ride-thru taco bell on the way to your next destination taco mode will first be available in orange county california in late july and early august it will expand to additional markets by year's end and roll out nationwide next year",2
925,"the three generations of family died went the flood water rushed through a swimming hole on july 15th tonighta 10 percent chance of showers and thunderstorms before 11pm partly cloudy with a low around 76 south wind around 5 mph becoming light and variable wednesdaya 20 percent chance of showers and thunderstorms mostly sunny with a high near 101 light and variable wind becoming west northwest 5 to 8 mph in the afternoon wednesday nighta 10 percent chance of showers and thunderstorms partly cloudy with a low around 78 northwest wind 5 to 9 mph becoming light and variable thursdaya 10 percent chance of showers and thunderstorms after 11am mostly sunny with a high near 101 west northwest wind 5 to 9 mph thursday nighta 20 percent chance of showers and thunderstorms mostly cloudy with a low around",2
926,"his colleagues saying he would not support the republican bill as it's written now he said progress will take compromise let's trust each other let's return to regular order we've been spinning our wheels on too many important issues because we keep trying to find a way to win without help from across the aisle it took a tie- breaking vote from vice president mike pence to get the debate going the senate was split 50-50 with 2- republicans lisa murkowski of alaska and susan collins of maine votin no no democrats supported it we can do better than obamacare we have a responsibility to the american people to do that today's vote to begin debate is the first step and we should take it turn back now before it's too late and millions and millions and millions of americans are hurt so badly in ways from which they will never ever recover the senate will now move on to debate and vote on a variety of approaches to health care reform",2
933,"were removed after making outburst in the gallery here's some of the debate from lawmakers for and against the bill senate bill 3 offers a statewide solution in hitting the reset button it moves the authority of setting this policy for our political subdivisions to the state so we don't see this playing out school district by school district some of our texans who quite frankly were minding their own business living a very product life and now",2
937,"i will not support it form i will not support it today senator heller sent fox5 this statement saying in obamacare isn't the answer but doing nothing to try to solve the problems it has created isn't the answer either if the final product isn't improved for the state of nevada then i will not vote for it coming up at five we will have more details on",2
940,"cherney amhara fox5 news local las vegas governor sandoval released a statement after the vote in it he says quote my healthcare conversations have been focused on policy not procedure my policy position has not changed i will continue to do all i can to protect the thousands of nevadans whose lives are healthier and happier as a result of the expansion of medicaid",2
943,"investigation into any dealings he had with russian officials ahead of the 2016 election he says he took part in four meetings with russians during and after president trump's presidential victory insisting he did not collude with russia - saying all his actions were proper and he has nothing to hide he expressed receptivity to coming back for further questions but it was a very productive session we had an opportunity to ask about a range of issues the committee has been concerned about we appreciate his voluntary willingness to come and testify today kushner also released an 11- page statement on this vote the yahs are 50 and the nays are 50 the senate being equally divided the vice president votes in the afffirmative the motion is agreed to gavel and with that senate republicans agree to open the debate on the bill to repeal obamacare",2
944,"it's current form fox's jane metzler explains what happens next nats i ask for the yeas and nays nats protesters kill the bill kill the bill kill the bill don't give up kill the bill don't give up even before their victory republicans were interrupted on the floor of the senate outside the senate chambers minnesota democrat al franken said there's too much confusion over the future of health care franken we don't know what their republicans' bill is they don't know what their bill is jeff merkley of oregon says everyday americans need to rally against efforts to roll back obamacare",2
945,"what we're looking for for insurance is affecting people with disabilities in a way that others aren't even aware of she wasn't the only republican with sharp words about health care senator john mccain making a highly publicized return to work following a cancer diagnosis mccain stop listening to the bombastic loud mouths on the radio and on the television and on the internet to hell with them mccain got a standing ovation but says he will not support the current bill insisting major changes need to be made in order to win him over jane",2
946,"him over jane metzler---fox news the senate is expected to take another vote tomorrow on an amendment to repeal obamacare trump i'm very disappointed with the attorney general we will see what happens time will tell the president taking another swipe at attorney general jeff sessions trump i want the attorney general to be much tougher on the leaks from intelligence agencies which are leaking like rarely have they ever leaked before at a very important level these are intelligence agencies we cannot have that happen",2
947,"ground before pulling away witnesses say when they went out to check on the car seat the baby was crying karan it's heart breaking and something i've never seen in my life butt to erick i approached the car seat and noticed that there was a small baby inside",2
948,"investigators in florida are looking into this video posted online look closely-- the boat is dragging a shark behind it the state fish and wildlife conservation commission says it's unclear if any laws were broken-- but the agency wants to talk to the boaters responsible",2
949,"scouts of america are urging members to look into careers in math and science the organization adding 23 new badges--- related to science technology engineering math and the outdoors girl scouts can earn badges through activities like designing model race cars writing code programming robots and going on environmentally conscious camping trips last month the organization added cybersecurity badges which will be available over the next two years to girls in kindergarten through 12th grade a florida teen will be feeling lucky for life daniela leon ruz won a weekly payday off a",2
950,"win for repubicans after a previous failed attempt earlier this year one of the biggest moments of the day came with the return of senator john mccain back in washington for the first time after being diagnosed with brain cancer last week i voted for the motion to proceed to allow debate to continue and amendments to be offered i will not vote for this bill as it is today it's a shell of a bill right now we all know that the house of representatives overwhelmingly passed the sanctions bill today it includes new sanctions against iran and north korea and gives congress the ability to block any effort by the white house to weaken sanctions on russia the senate still has to approve",2
951,"but today he voted to continue with talks for the healthcare overhaul hellers office sent out this statement it says i will vote to move forward and give us a chance to address the unworkable aspects of the law that have left many nevadans - particularly those living in rural areas - with dwindling or no choices if the final product isn't improved for the state of nevada then i will not vote for it if it is improved i will support it",2
952,"governor brian sandoval has also come out against the proposals today he sent out a statement as well it says my healthcare conversations have been focused on policy not procedure my policy position has not changed i will continue to do all i can to protect the thousands of nevadans whose lives are healthier and happier as a result of the expansion of medicaid president donald trump however was pleased with today's vote we're now one step closer to liberating our citizens from",2
993,"it got only 50 votes leaving the republicans to just debate repeal and replace love to hear your point of so i want my glasses to be unique my girlfriend loves artists and i need a conservative pair",2
1016,"questions that you would like a vet to answer you can email to us at news at kyoutv dot com senate republicans agreeing to open the debate on the bi repe today vice president mike pence casting deciding vote after the senate became deadlocked on whether to move forward with the healthcare debate pence's vote of yea making the final vote 51 yeas and 50 nays president trump has been urging republicans",2
1017,"as you know the senate just voted to proceed with the obamacare repeal and replacement issue we'll be on reconciliation for the rest of the week processing amendments i offered one and then there will be others it's an open amendment process this is just the beginning we're not out here to spike the football but we'll finish at the end of the week hopefully with a measure that can go to the house and be",2
1027,"up his criticism of jeff sessions he's unhappy sessions recused himself in into the investigation of russian investigation he did not say whether he intends to fire him disappointed but we will see what happens time will tell time will tell president trump's",2
1040,"days - to work on some other business he will then head back to arizona to get more treatment buthas every intention of returning to the senate president trump's son-in-law and senior adviser met with lawmakers of the house intel committee the panel that heard from jared kushner for about three hours today is investigating russian interference in the 2016 presidential campaign and possible involvement of trump associates kushner had a similar interview with staff on the senate intelligence panel yesterday the president's former campaign manager paul manafort has told senate investigators about his recollection of a trump tower meeting with a russian lawyer last year",2
1049,"evening i'm tara herrschaft right now chief president of the senate was the tie breaker vote this afternoon as senate republicans voted to start the debate on a possible repeal and replace of the affordable care act the",2
1,"vote to break the deadlock on this boat the a's are 15 and the names are 50 the senate been equally divided the vice president votes in the affirmative and the motion is agreed to and the most emotional moment coming when senator john mccain who was recently diagnosed with brain cancer",1
2,"and former republican candidate he spoke for the first time publicly since his diagnosis and called for bipartisanship our house system is a mess we all orknow it those who support and oppose it something has to be done we have looked for a way to end it and al preplace it to something else without paying a terrible price we haven't found it yet",1
13,"the affordable care act also today the house passed a new bill to add more sanctions against russia the measuure also includes sanctions against iran and north korea and allows congress to block any plan by the white house to weaken any sanctions against russia the senate still has to sign off on the bill president donald trump has not said whether he will sign it a u-s navy ship fired warning shots at an iranian patrol boat it happened today in the northern end of the persian gulf officials say the iranian boat came within 150 yards of the u-s-s thunderbolt the",1
14,"republicans voted to move forwar senate republicans voted to move forward with repeal and replacement on obamacare or affordable care act vice president mike pence broke the vote the yeas are 50 and the nays are 50 president trump then spoke with the prime minister of lebanon brian is in the weather center with",1
15,"is applauding the way his son-in-law jared kushner is handling the russian collusion investigations he took things to twitter saying jared kushner did very well yesterday in proving he did not collude with the russians witch hunt next up 11 year old barron trump",1
16,"old barron trump barron is the president's youngest son who's not actually under investigation for anything however kushner will face more questions about russia this time in front of a house panel his personel is you all know that he's the executive branch for the legislative branch he determines who's hired and fired in the executive branch that's his perogative reaction is coming in swift today after president donald trump blasts his own attorney general jeff sessions",1
17,"out our jerry hume is in the web center with reaction again from his boss on twitter today president trump tweeted attorney general jeff sessions has taken a very weak position on hillary clinton crimes where are e-mails dnc server intel leakers",1
18,"the terrorists' flag suspect with the he was indicted for trying to provide material or support a foreign terrorist organization birney bervar we pled not guilty to the charges and a trial date has been set we'll be preparing our defense kang was with the 25th infantry division at schofield barracks in honolulu his trial is set for september",1
19,"news 13 news weather now exclusively on spectrum and the nays are 50 the senate being equally divided the vice-president votes in the affirmative and the motion is agreed to",1
20,"arizona and former republican presidential candidate he spoke for the first time publicly since his diagnosis and called for bipartisanship our healthcare insurance system is a mess something has to be done we republicans have looked for a way to end it and replace it with something else without",1
21,"continues once they release information or name these individuals we'll let you know i'm julie garg ata meeting with lawmaker lawmakers on the house intelligence committee on tuesday the meeting lasted for 3 hours the house panel is investigating russian interference in the 2016 presidential campaign and possible involvement of trump associates kushner had a similar interview with staff on the senate intelligence panel monday president's former campaign chairman paul manafort met with senate investigators about his controversial meeting with a russian lawyer last year",1
25,"care reformpassed the test to begin debate while senator john mccainseized opportunity to call for the bipartisanship lessthan a week after a brain cancer diagnosis the 80 year old senatorcame back to washington and cast a vote he then spokepublicly for the first time since the diagnosis let's trust eachother let's return to regular order we've been spinning our wheels ontoo many important issues because we keep trying to find a way to",1
27,"it will either be full repeal without replace or something far too close to that back at the white house this was a big step i want to thank senator john mccain the president spending a great deal of a joint press conference with the lebanese prime minister speaking about attorney general jeff sessions dealing with leaks im very disappointed with the attorney general but",1
31,"is urging the trump administration to take action to bring him home levinson vanished in 2007 while traveling to an island in iran he had been hired as a c-i-a contractor a year earlier but the white house says he was not a government employee when he",1
32,"of the detectors has been the source of increased tension including widespread palestinian protests in jerusalem and the west bank the boy scouts of america is on a u-s navy patrol ship fired warning shots at an armed iranian patrol boat today u-s defense officials say it happened in the northern end of the persian gulf the officials say the iranian boat approached and came within 150 yards of the u- s-s thunderbolt the iranians didn't respond to any warnings from the u-s so the navy ship fired warning shots into the water the iranian ship backed away but lingered in the area for",1
33,"they claim there is evidence that people in the u s were designated to receive bribe money jared kushner was on capitol hill for the second day in a row today answering questions about the russia investigation he spoke with members of the house intelligence committee for about three hours",1
34,"intelligence committee for about three hours lawmakers suggested he may have to come back for more testimony in the future we had a good opportunity to ask mr kushner questions this morning he expressed and his counsel receptivity to coming back for further questions but it was a very productive session we had an opportunity to ask about a range of issues that the committee has been concerned about and we appreciate his voluntary willingness to come and testify today",1
35,"stop their car it crashed and they ran they caught 2 right away and the 3rd hiding under a porch the senate voted to move ahead with republicans' plans to repeal and replace obamacare the vote was 50-50 but vice president mike pence cast the tie breaking vote two republicans joined all 48 democrats to vote no senator john mccain entered the chamber to a round of applause and cast his vote in favor of moving forward with the debate",1
36,"in perfect and pulled compromises the not too pleasing to implacable people on both sides but it might provide a workable solutions to problems americans are struggling with the day what do we have to lose to work together to try to find those solutions mccain emphasized he would not support the bill in its current form and",1
37,"from damond's home the bca says damond is not a suspect just quote an individual involved in an incident well the showdown over healthcare is playing out today on the senate floor republicans making a final effort to repeal or replace obamacare the vote so significant senator john mccain returned to washington d c to cast h vote despite being diagnosed with brain cancer just a week ago after voting to move forward senators will now debate the repeal and possible replacement of president obama's healthcare law all we've managed to do is make more popular a policy that wasn't very popular when we started trying to get rid of it",1
38,"the wheel a little easier plus change is coming to utsa who the university just announced as its new president problems we all have them the first step to dealing with a problem is admitting it exists it seems that the democrats are taking that first step when you lose an election with someone who has a 40 popularity you look in the mirror and say what did we do wrong and the number one thing that we did wrong is we didn't tell people what we stood for the democrats do appear to be learning from their losses in the 2016 presidential election they understand that they have largely fallen out of touch with the american people a recent",1
39,"american people a recent poll found that only 37 of americans think the democrat part stands for something 52 says it just stands against president trump what is the democratic party to do apparently it is time for senators announce a new plan a better deal better jobs better inch with aes better future yes the slogan may remind you of a popular pizza chain",1
40,"proposals creating 10 million jobs through apprenticeship programs lowering prescription drug prices there are some strong issues to focus on the trump administration is already working on some of them last month president trump signed an executive order to substantially increase the number of apprenticeships in the united states the administration is also working on plans to address the high cost of prescription drugs slogans are great but democrats need to connect with american people by action not words movement on agenda items where the democrats actually agree with the white house would be a good start some parts of the democrat better deal line up with the policies of the white house so we",1
41,"for misdemeanor assault but ultimately plead to a lesser charge today green's publicist responded to the suit saying quote - this lawsuit relates to an incident that occurred in east lansing michigan over a year ago for which draymond paid a noise violation fine draymond looks forward to defending himself and clearing up the misinformation put forth today",1
42,"ask a jury to educate him and hold him accountable live in woodland hill chelsea edwards eyewitness news thank you the u s senate has voted to move ahead on health care legislation aimed at dismantling obamacare",1
43,"the hour some of the family members have already spoken there and we'll move the calm are a little bit to show you a live picture are the floor of the u s senate where the health care debate is now underway the vice president votes in the affirmative and the motion is agreed to vice president mike pence breaks a tie in the senate",1
44,"the senate which continues debate on the republican plan to either repeal and or replace obamacare having been given a responsibility to govern we have a duty to act mr mccain aye a bipartisan standing ovation for senator john mccain returning a week after revealing he's battling brain cancer i voted for the motion to proceed and allow debate to continue and amendments to be offered i will not vote for this bill",1
45,"vote for this bill today as it is today kill the bill protestors chanted inside as democrats uniformly opposed this don't be fooled by this ruse we have lost an important battle today but we have not yet lost this war the president expressed support for the bill now we're all going to sit together and",1
46,"the president has expressed his displeasure with sessions michaelson abc 7 eyewitness news recusing himself from russia-related investigations later today the president refused to say whether he will keep sessions on president i told you before i am very disappointed with the attorney general but we will see what happens time will tell there",1
47,"the paris agreement there's only one man that dropped out and other people will follow china is coping this cap and trade plan quebec has already joined ontario is coming in washington and oregon and i believe that other states on the east coast will follow",1
48,"his 2020 re-election president donald trump holds a campaign style rally in ohio health car the first top k as the republican plan to repeal and or replace obamacare moves forward in the senate we're now one step closer from liberating our citizens from this obamacare nightmare in the senate vice president mike pence is needed to break a 50-50 tie the vice president votes in the affirmative and the motion is agreed to",1
49,"vote for this bill today as it is today kill the bill protestors chant inside as democrats uniformly oppose this this is the most dangerous and destructive piece of legislation ever to be discussed on the floor of the senate in the modern history of this country turn back now before it's too late and millions and millions and millions of americans are hurt so badly in ways from which they will never ever recover",1
50,"twitter calling sessions weak on what trump calls hillary clinton crimes as well as on leakers then later during a news conference with the lebanese prime minister repeating his displeasure with sessions recusing himself from the russia investigation and leaving open the possibility he might fire sessions if he was going to recuse himself he should told me prior to taking office and i would have quite simply picked somebody else",1
51,"passed a similar measure last month the white house is not saying whether president trump will veto the final bill these sanctions are a clear signal that the united states will hold president putin and his close associates accountable for their actions president trump's son-in-law jared kushner spent three hours meeting behind closed doors with lawmakers on the house intelligence committee looking into russian interference in the election campaign former trump campaign chairman paul manafort met with the senate intelligence committee",1
