"cluster","sampleText","num_transcripts"
139,"be reading your comments tonight on nightbeat come join us at 00 on our sister station kbcw 44 cable 12 what should i watch show me sports it's so fluffy look at that fluffy unicorn he's so fluffy i'm gonna die your voice is awesome the x1 voice remote xfinity the future of awesome food water internet we need it to live but what we don't need are surprises like extra monthly fees i see you fee played by legendary actress anjelica huston you got me mark we just want fast internet for one simple rate for all the streaming and the shopping and the newsing but most of all for the this internet for one everyday simple price and no extra monthly fees",14
6,"capitol hill today to cast the 50th vote for debate on the bill the arizona republican recently had brain surgery after being diagnosed with an aggressive brain tumor he was welcomed to the senate floor with a standing ovation applause after voting mccain addressed the senate asking lawmakers to work together for the good of the american public he stressed that a lot of work needs to be done sen john mccain r- we republicans have looked for a way to end it and replace it with something else without paying a terrible political price we haven't found it yet and i'm not sure we will all we've managed to do is make more popular a policy that wasn't very popular when we started trying to get rid of it i voted for the motion to proceed to allow debate to continue and amendments to be offered i will not vote for this bill as it is today",10
1030,"enough votes to win the tie breaker mccain then took the floor gave his colleagues a tongue-lashing on diplomacy 21-33 let's trust each other let's return to regular order we've been spinning our wheels on too many important issues because we keep trying to find a way to win without help from across the aisl e white flash 44- 51 we're getting nothing done my friends we're getting nothing done",9
393,"that are filed are being ignored airlines are being slapped with fines from federal regulators the internet changed how lent's discovered and now centurylink is changing the way you get internet we'll help you find the speed you need to surf stream or become an internet sensation yourself get started with up to 40 megs for 20 dollars a month for one year when bundled with a qualifying home phone plan speed may not be available in your area centurylink your link to what's next women in stem careers 23 new badges will be added related to science technology engineering math and the outdoors now girl scouts can earn badges through activities like designing the girl scouts want to see more women in stem careers 23 new badges will be related to science technology engineering math and the great outdoors now they can earn badges through activities like designing model racecars writing code programming robots going on environmentally conscious camping trips",8
57,"severe weather alerts and more download the app for free on any device we'll be right back end wx end once again we saw more thunderstorms today in the higher elevations with more seasonable heat in the interior the concerns with thunderstorms remains new fire starts from lightning and gusty winds fanning already present fires we will see another round of mountain thunderstorms wednesday but quiter conditions by thursday and friday we are also tracking another heat wave for the interior thursday and into next week heat will likely peak around monday or next tuesday you're watching krcr news channel 7 at",7
249,"of cars on the right hand side that's your southbound traffic looking better stay with us back after a break who are these people the energy conscious people among us say small actions can add up to something humongous a little thing here a little thing there starts to feel like a badge maybe millions can wear who are all these caretakers advocates too turns out it's californians it's me and it's you don't stop now it's easy to add to the routine join energy upgrade california and do your thing there's a big change for tourists visiting the vatican this summer",7
404,"area -- high winds and lightning are also a threat the chance for storms sticks around through thursday but by senate republicans are moving forward with their attempt to fulfill a long- held promise still ahead the latest g-o-p move in an attempt to repeal and replace obamacare you're watching six on your side break you're watching today's 6 live at 00 attorney general jeff sessions was one of president trump's earliest and most loyal supporters during the campaign at the time he was the first senator to endorse the outsider candidate but in recent months their relationship has become strained the president growing more frustrated with sessions' decision to recuse himself from the russia investigation the president",7
1029,"madeleine rivera news 12 connecticut a dramatic day in the u s senate where protesters made their voices heard before a key vote on health care reform vice president mike pence cast the tie breaking vote on a motion to allow debate to begin on a republican plan to repeal and replace the affordable care act two republicans voted no but senator john mccain returned to washington",7
4,"the senate to not only speak about the importance of bipartisan unity but his health and his future in the senate what have we to lose of our incapacity let's trust each other let's return to regular order we've been spinning our wheels on too many important issues because we keep trying to find a way to win without help from across the aisle that's an approach that's been employed by both sides mandating legislation from the top down without any support from the other side with all the parliamentary maneuvers that requires we're getting nothing done my friends we're getting nothing done it is an honor applause mccain cast a necessary republican vote for the motion after two gop senators -- susan collins and lisa murkowski -- sided with all democrats in opposition",6
10,"health care reform passed the test to begin debate while senator john mccain seized the opportunity to call for bipartisanship less than a week after a brain cancer diagnosis the 80 year old senator came back to washington and cast a vote he then spoke publicly for the first time since the diagnosis let's trust each other let's return to regular order we've been spinning our wheels on too many important issues because we keep trying to find a way to win without help from across the aisle we're one step closer to liberating our citizens from this obamacare nightmare",6
22,"down right now stay with news 13 for updates as our crews on the ground gather more information right now-- the senate voted to move forward with a motion to begin debate on the repeal and replacement of obamacare on this vote the 'yays' are 50 and the 'nays' are 50 the senate being equally divided the vice president votes in the affirmative and the motion is agreed to",6
380,"and republicans worked on extending the bill a lesson he says lawmakers in washington d-c could learn from sot full it's a message that we have a functional government here in california where democrats and republicans work together applause and i think this is a very important message for washington where both of the parties can not work together so i hope they learn something from this vo the bill helps ensure california meets its 20-30 greenhouse gas emission reduction targets",6
432,"a holdout among republicans when it comes to an obamacare repeal but today he voted to move forward in a statement he said in part quote obamacare isn't the answer but doing nothing to try to solve the problems it has created isn't the answer either that is why i will vote to move forward and give us a chance to address the unworkable aspects of the law that have left many nevadans - particularly those living in rural areas - with dwindling or no choices",6
585,"bill can happen on the senate floor mccain also called on his fellow senators to return to civility and to work together i hope we can again rely on humility and our need to cooperate on our dependence on each other and learn to trust each other again and better serve the people who elected us stop listening to the bombastic loud mouths on the radio and the television and the internet to hell with them mccain said",6
908,"gases across the nation tonight senator john mccain makes a historic return to capitol hill just as senate republicans vote to advance the floor debate on their efforts to repeal and replace obamacare k-u-s-i's lauren phinney has more on that vote and senator mccain's return lauren allen senate republicans are moving forward with their attempt to fulfill a long- held promise to repeal and replace obamacare the senate passing a motion to begin debate on the house-passed health care bill vice president mike pence cast the tie-breaking vote a vote that came during the dramatic return of senator john mccain who traveled back to washington today despite being diagnosed with a rare brain cancer",6
1048,"republicans are standing by the president inclu ding north carolina senator thom tillis president donald trump- he should not trump- he should not have recused himself almost immediately after taking office and if we was going to recuse himself he should have told me prior to taking office and i would have quite simply picked somebody else",6
5,"today he answered more questions about russia kushner also released an 11-page statement and denied collusion with the russian government kushner said he had four meetings with russians last year but insists he discussed nothing improper",5
92,"both parties gave the senator a standing ovation he gave remarks about unity and the senate's role in american government we are an important check on the powers of the executive our consent is necessary for the president to appoint jurists and powerful government officials and in many respects to conduct foreign policy whether or not we are of the same party we are not the president's subordinates we are his equal mccain also stressed work mccain also stressed work needs to be done on a new health care plan saying he would not vote for a bill to repeal the affordable care act as it stands today kill the bill don't kill us mccain's statements came immediately after vice president mike pence cast the tie-breaking vote and after a rare gallery protest - interrupting the senate floor - just as that vote began now gop members will move forward to decide - what exactly",5
171,"tomorrow tomorrow here at 00 more rain i'll run the hour-by-hour forecast up to this point and beyond to see whoa you're not taking these hey hey hey you're not taking those whoa whoa you're not taking that come with me you're not taking that you're not taking that you're not taking that mom i'm taking the subaru don't be late even when we're not there to keep them safe our subaru outback will be vo love it's what makes a subaru a subaru",5
200,"for what must be covered a proposal to simply repeal the affordable care act may also be on the table senator john mccain received a standing ovation on the senate floor today - as he returned to vote for opening debate on a health care bill the arizona republican was recently diagnosed with brain cancer after the procedural vote mccain addressed the floor saying that he would not vote for the health care bill as it stands today sen john mccain r- our healthcare insurance system is a mess we all know it those who support obamacare and those who oppose it something has to be done we republicans have looked for a way to end it and replace it with something else without paying a terrible political price we haven't found it yet and i'm not sure we will all we've managed to do is make more popular a policy that wasn't very popular when we started trying to get rid of it mccain",5
318,"out of a plane to do just that u hear it this ice cold coke is calling you i'm just a dollar at mcdonald's come get me don't let the ice cold deliciously refreshing coke down it's waiting for you and the clock is ticking so go now - like right now and get any size soft drink for just 1 only at mcdonald's just days after a brain cancer diagnosis senator john mccain cast a pivotal vote to move forward on health care",5
430,"inside the white house here in the white house rose garden president trump is set to give a joint announcement with the prime minister of lebanon but of course the biggest talking point in our nation's capital is healthcare reform i'm very happy to announce that with zero of the democrats' votes the motion to proceed on healthcare has just passed",5
431,"with lebanese prime minister saad hariri was delayed while both heads of state watched the live feed from the senate as vice president mike pence cast the tie-breaking vote we had two republicans that went against us which is very sad i think very very sad for them but",5
433,"opens debate on possible reforms but even the president acknowledged it's not a simple process and it's far from over now we are all going to sit together and we are going to try and come up with something that's really special we have a lot of options",5
434,"the mess not only is driving through high water danger the internet revolutionized early in the morning how talent's discovered rising up to meet the sun in the sky and now we're revolutionizing the way you get internet intrucing centurylink price for life -- get any speed up to 25 megs for 45 a month and keep that price year after year no hidden fees no contract finally an internet price you can count on speed may not be available in your area ooh centurylink your link to what's next washington politicians won't stop trying to repeal our health care it'll be a completete disaster for nevada senator heller promised to protect our healthcare but he refuses to take a stand even though the bill slashes medicaid and over a hundred thousand nevadans will lose insurance heller won't say no even though our premiums will skyrocket while the wealthy drug and insurance companies get hundreds of billions in tax breaks senator heller stand up for nevadans vote no on healthcare repeal",5
674,"show you some stories you will only see here on krbc but first here is what you can catch on nbc nightly news with lester holt ahead for us tonight in dramatic fashion republicans eek out the votes to start the health care debate the clock now ticking as anxious americans await the outcome president trump takes to the podium to trash his attorney general a look at what the president's end game might be and why some police officers worry their patrol vehicles are making them sick on nbc nightly news",5
953,"cerrada estuvo la votacion en la que los republicanos logran iniciar el proceso para derogar el obamacare fernando pizarro amplia aunque continuaron las protestas como esta de incapacitados en el capitolio los republicanos lograron estrechamente mantener viva su propuesta de revocar y reemplazar obamacare fue el senador john mccain diagnosticado con cancer quien fue ovacionado por todos sus colegas al retornar desde arizona para su voto clave a favor aunque dijo que se opondra si la propuesta final no tiene cambios sen john mccain r-arizona vote por continuar la idea de avanzar esta propuesta pero no votare a favor de este plan como",5
954,"a las personas con impedimentos que se limiten y eso hace pues que se deteriore su salud mario galdamez manifestantees bien importante que la comunidad latina este presente porque los recortes afectan a muchas personas que reciben beneficios el vice presidente mike pence dio el voto definitivo en la votacion 51-50 en lo que es una victoria para los republicanos y la casa blanca trump dijo que era el comienzo del fin de",5
955,"medico jane delgado alianza nacional para salud hispana todavia tenemos 1 tercio de hispanos que no tienen aunque es obamacare claro hay cambios que tenemos que hacer pero hacer 1 programa donde mas personas no van a tener seguro no vale fernando pizarro washington d c todo esto significa que la propuesta republicana para derogar obamacare sigue viva por ahora sin apoyo democrata el apoyo de todos los republicanos",5
3,"has taken another step -- towards overhauling health care senators voted today -- to start debating republican legislation to repeal the affordable care act with the vote tied -- the vice president cast his vote to break the deadlock on this vote the yeas are 50 and the nays are 50 the senate being equally divided the vice president votes in the affirmative and the motion is agreed to the most emotional moment came when senator john mccain who was recently diagnosed with brain cancer",4
9,"lot covered in that hour-giving voters a lot to think about live in st petersburg saundra weathers bay news 9 senate republicans have jumped over the first hurdle to healthcare bill- advance their and it was a close one on this vote the yeas are 50 and the nays are 50 the senate being equally divided the vice president votes in teh affirmative and the motion is agreed to the chamber held a nail-biting vote tuesday to start debate on the legislation vice president mike pence ended up breaking the",4
11,"bill has passed while the senate was voting on health care members of the house passed new sanctions against russia the plan also includes new sanctions against iran and north korea -- and it gives congress the power to block any effort by the white house to weaken sanctions on russia the senate still has to approve the plan president trump has not",4
23,"diagnosis and called for bipartisanship our health care insurancesystem is a mess those who oppose obamacare and those who support it something has to be done we republicans have looked for a way toend it and replace it with something else without paying a politicalprice we haven't found it yet don't tell lies kill the bill don't tell lies kill the bill",4
24,"once they release any more information or name these individuals we'll let you know in the studio i'm julie gargotta president donald trump's son-in-law and senior adviser met with lawmakers on the house intelligence committee today tuesday the meeting lasted for about three hours the house panel is investigating russian interference in the 2016 presidential campaign and possible involvement of trump associates kushner had a similar interview with staff on the senate intelligence panel monday the president's former campaign chairman paul manafort met with senate investigators about his recollection of the controversial trump tower meeting with a russian lawyer last year",4
95,"thinks we're on track while the other believes we're off the rails the fix was already in long president said the senate being equally divided the vice president votes in the affirmative and the motion is agreed to",4
167,"before farm to table before field to fork there was just good wholesome food grown by america's farm families prepared fresh at culver's and always served with a smile we still cook every butterburger to order using the finest cuts of fresh 100 midwest beef and craft our frozen custard right in the restaurant using family farm fresh dairy so thank you farmers and to all the welcome to delicious live from colorado's news channel this is cbs4 news at 30 the senate is moving ahead with debate on repealing obamacare john mccain returns to the capital for the first time since being traded -- treated for brain cancer to cast his critical vote mccain",4
336,"korea russia and iran and limit president trump's ability to undo them it's unclear whether the president will veto it these sanctions are a clear signal that the united states will hold president putin and his close associates accountable they're also a declaration that congress can and will act even when president trump refuses to do so president trump today intensified his criticism of attorney general jeff sessions saying he should not have recused himself from the russian investigation and the president's son-in-law jared kushner",4
338,"worried about his family and what could happen next a setback for republicans the senate voting 57-43 rejecting a comprehensive proposal to replace the affordable care act it came hours after the senate voted to start the debate vice president mike pence breaking the tie on capitol hill also lending hills support senator john mccain a scar visible bof his left eye after brain surgery but after casting his vote to move forward to debate -- mr mccain aye he spoke his mind expressing reservations on what comes next it is a shell of a bill right now we all know that i have changes urged by my state's governor that have to be included to earn my support for final passage any bill protesters against the repeal making their voices heard around the capitol and",4
339,"to lame i thinked amount of medical liability and we might go bankrupt caring for my sister despite the setback president trump at a make america great rally in ohio was feeling renewed momentum on repealing obamacare we're now one step closer to lit rating our citizens from this obamacare nightmare republicans now trying to hash out a bill they can pass without any democratic support",4
340,"its kind in the country and is serving a model china is copying this cap in trade plan quebec has joined ontario is coming in washington and oregon and i believe other states on the east coast will follow",4
379,"lauren also today the house approved legislation that hits russia iran and north korea with additional financial sanctions the bill prevents president donald trump from waiving the sanctions against russia without first securing permission from congress the measure now heads to the senate for action",4
429,"us rain chances sunday monday and tuesday closed captioning will resume closed closed captioning will resume closed captioning will resume senate republicans are moving forward with their attempt to repeal and replace obamacare the senate is passing a motion to begin debate on the house-passed health care bill the high-stakes vote had been in peril for days with democrats united in their opposition and at least two republicans holding out the vote comes during the return of republican senator john mccain-- who traveled back to washington tuesday after being diagnosed with a rare brain cancer pres donald the motion to proceed on health care has passed and now we move towards truly great health care the plan now gets complicated senators will vote on several amendments that would strip the house health care bill language - including the 2015 repeal bill but the final version is still very much up in the air",4
597,"close to average for a couple days jumping back up close to 100 for valleys by the weekend -jeff isolated showers and thunderstorms partly cloudy with a low around 64 northwest wind around 5 mph becoming northeast in the evening chance of precipitation is 20 mostly sunny with a high near 92 calm wind becoming southwest around 5 mph in the afternoon wednesday mostly clear with a low around 61 west wind 5 to 10 mph with gusts as high as 20 mph sunny with a high near 95 calm wind becoming north around 5 mph in the afternoon thursday mostly clear with a low around 62 sunny with a high near 96 friday a slight chance of showers and thunderstorms after 11 pm partly cloudy with a low around 64 a slight chance of showers and thunderstorms before 11 am mostly sunny with a high near 98 saturday mostly clear with a low around",4
629,"livestock loss pasture loss hay loss andfence loss there are 656 perosnnel working the fire which has destroyed 16 homes a fire threatening 50 structures near tarkio tar-key- oh grows more than 1-thousand acres in the last 24 hours keeping it a top 3 priority fire nationally take vo the sunrise fire burning 11 miles southeast of superior is threatening 50 structures and has now burned over 23-hundred and 50 acres with no containment the mineral county sheriff's office has issued a stage 2 evacuation for the residents of sunrise and quartz flats telling them to be ready to evacuate quickly if things get worse",4
649,"now on live at 4- thank you for joining us stick around fox 13's live at five starts after this when i say wisconsin what comes to mind oh immediately cheese it's our calling card to the rest of the world all of these wonderful cheeses go on our wisconsin big cheese pub burger we got american cheddar and havarti this is a show stopper cheese our sweet bun with a roasted garlic mayo mmm this eats so well all the way through you've got that great crisp and the sear of the beef the melt on these cheeses couldn't be better with that havarti coming through this is a really terrific burger welcome to delicious",4
806,"the homeowners on today's announcement as you can imagine they are relieved to be spared the huge expense of demolition people are being urged to keep themselves and their animals out of the long tom and mountain home reservoirs in elmore county after blue- green algae was found in the water state agencies have issued a health advisory for both reservoirs blue algae can produce dangerous toxins and be harmful to people pets and livestock those with liver or kidney damage are at an increased risk of illness",4
