"cluster","sampleText","num_transcripts"
377,"intent to bring a case the house gutted the requirement and refused to go in conference about it republicans continue efforts to repeal and replace obamacare in washington after a failed attempt earlier this summer with mounting pressure the senate began to debate emily is in washington with the latest senate republicans are moving forward with a long held promise to repeal and replace obamacare the high stakes vote was in peril for days with democrats united a vote in favor to proceed this afternoon will be permission a permission slip to slash medicaid hurt millions and two republicans holding out the vote came during the dramatic return of senator john mccain who traveled to washington after being diagnosed came here today looking a little worse for wear",1
378,"the 99 privileged souls elected to this senate now it gets complicated senators will strip the house health care language the final version is very much up in the air on the other end of pennsylvania avenue pressure is mounting from president trump who spent the morning tweeting on health care taking an aggressive approach the motion to proceed on health care has passed now we move forward toward great",1
382,"page named 'help us construct a new clinic 'we'll have a link to that page on our kidk com website the u-s senate is moving ahead with debate on an obamacare overhaul today a tie-breaking vote from vice president mike pence to move things forward the next step will be getting a 'yes' vote on a final piece of legislation t his will be more difficult that's because the g-o-p leadership needs nearly every republican senator onboard for any action on healthcare because they only hold a slim majority and democrats are united in",1
383,"it up here and all of those same options will just come up yes the implant which has been fda-approved is the size of a grain of rice and is injected between the thumb and index finger by a licensed piercer this company is offering the chips which cost about 300 a piece to its employees for free westby says they are not gps enabled yet jy so you're not going to be tracking your employees around town to see what they're up to and what they're doing tw no we will not it's for entrance to the building logging into computers making purchases in our break room market",1
384,"for some a dystopian nightmare for others either way the future is here jy cbsnews river falls wi the microchip is the size of a grain of rice and to take it out it's like removing a sliver the pain factor by the way is like getting your ears pierced",1
385,"senate voted to move forward a plan to repeal and replace obamacare - after vice president mike pence cast a tie-breaking vote senate healthcare vote-vo-5 bill has a long way to go before getting final approval leadership will need nearly every republican on board because they only hold a slim majority",1
386,"more when we see you here at six final look at weathertonig mostly cloudy storms returning lower 70's south at captioning sponsored by cbs more complaints about the attorney general i want the attorney general to be much tougher on the leaks from intelligence agencies is jeff sessions' job in jeopardy time will tell time will tell and the motion is agreed to also tonight a narrow victory for senate republicans they win a key health care vote president and a defiant john mccain i have every intention of returning here and giving many of you cause to regret all the nice things you said about me why dozens of workers are having microchips implanted in their hands",1
388,"john mccain has brain cancer by his performance on the senate floor today days after major surgery mccain blasted his colleagues on both sides of the aisle we have been spinning our wheels on too many important issues because we keep trying to find a way to win without help from across the aisle that's an approach that has been employed by both sides mandating legislation from the top down without any support from the other side with all of the parliamentary maneuvers it requires we are getting nothing done my friends we are getting nothing done",1
389,"getting nothing done he voted for today's motion to proceed but he made it clear he only supports debate and will not vote for the current republican bill to repeal obama care i voted for the motion to proceed to allow a debate to continue i will not vote for this bill as it is today it is a shell of a bill right now we all know that i have",1
390,"final passage of any bill he took a direct shot at republican leaders for the way they crafted the bill we tried to do this by ing with a proposal behind closed doors and consultation with the administration and then springing it on skeptical members trying to convince them that it is better than nothing that it is better than nothing asking us to swallow our doubts in the unified opposition i don't think that will work in the end and probably shouldn't",1
391,"shouldn't in closing mccain always the fighter showed a softer side and a resolve to return to finish the job i have every intention of returning here and giving many of you cause to regret the nice things you said about me and i hope to impress on you again that it is an honor to serve the american people in your company thank",1
392,"republican vote mccain said let historians decide who is at fault he said right now both parties need to come together for the good of the american people immediately after this afternoon's vote president trump reacted during a news conference with the prime minister of lebanon i'm very happy to announce that with zero of the democrats' votes the motion to proceed on healthcare has just passed and now we move forward towards truly great healthcare for the american people senate democrats are still fighting what republicans have proposed so far do not kid yourself when you throw 22 million americans off of the health care they have people with cancer people with diabetes people with",1
394,"improve the quality of health care both providers hope to develop an integrated network with other regional providers the feds may revise auto fuel efficiency requirements starting with the 2021 model year that would be a year earlier than previously disclosed",1
395,"speech that took aim at both parties a signal of what is to come in this whole health care debate our deliberations can still be important and useful but i think we would all agree that they haven't been overburdened by greatness lately and not producing much for the american people both sides have let this happened let's leave the history of who shot first i suspect they'll find we all conspired in our decline by deliberate actions or neglect we",1
399,"reasons for the u s government to settle this all right chris thank you a wild story so another setback for the gop health care bill late tonight the senate voted to repeal and replace the affordable care act with the senate's current bill but they failed tomorrow the senate is expected to vote to repeal the affordable care act with a two- year delay to replace it now earlier today in the senate's typically quiet chamber a hero's welcome for john mccain who is fighting brain cancer during his speech he urged to stand up to president trump whether or not we are of the same party we are not the president's subordinates we are his equal",1
401,"out what killed a baby orca in captivity but the answers could be at least a month away three-month-old kyara was being treated for an infection when her health suddenly declined she died yesterday at the san antonio park sea world has yet to say specifically what caused her death but animal rights activists say a life spent in captivity could be to blame this is about forcing these animals into a situation where they dont have any adaptations to and because of that you basically see them dying left and right kyara was the last killer whale born in seaworld's captivity seaworld announced last year that it",1
402,"pump the cap and trade legislation is part of the overall goal to slash greenhouse gases 40 percent by 2030 after a key healthcare vote senate republicans have officially begun the debate process on a plan to repeal and replace obamacare president trump has been pushing republicans but as mola lenghi reports it took a tie-breaking vote from the vice president and the return of arizona senator john mccain to get it done",1
403,"the other top candidates on kiro7 com president trump headed back to washington d c after celebrating today's senate vote to begin debating legislation aimed at dismantling obamacare in youngstown ohio he said that republicans are one step closer to quote liberating our citizens from this obamacare nightmare and delivering great health care for the american people the cbs evening news will have more on the president's response as well as his attacks on attorney general jeff sessions",1
406,"unfair and is now criticizing sessions as weak on investigating hillary clinton's private email server i told you before disappointed we will see what happens time will tell there was a chorus of support on capitol hill today for sessions - republican senators defending their former colleague but no lawmakers went out of their way to condemn the president's comments the showdown over health care playing out today on the senate floor senate republicans in their last ditch effort to repeal or replace obamacare the vote so significant senator john mccain returning to washington to cast his vote abc's megan hughes has all the details",1
410,"waiting nearly two weeks in a safe house ten people found inside the tractor-trailer early sunday died new at four police chiefs from around texas turn out against a so- called bathroom bill standing together outside the statehouse shoulder to shoulder in their opposition to the proposal- as inside the building state senators debated a plan to mandate that people use the restroom corresponding to the sex on their birth certificate law enforcement officers and local leaders call the bill unnecessary saying it would pull police officers from the streets the groups also questioned exactly how officers are supposed to enforce it this bathroom bill is a horrible solution to a non-existent problem that puts at risk and threatens some of the most vulnerable in our community butted together with we have yet to find anything that this will prevent because in truth this is a purported solution",1
412,"her car then seconds later nats the heart-stopping sound of the fast moving train nats train police could only standby and watch as the train barreled through the crossing but it did not hit the car police say the driver was spared by a few feet at most it was just she's extremely blessed to be alive initially i thought maybe we could push her off the tracks with the push bumpers but without getting the police tahoe struck by the train - we were powerless once the train goes through you can see how close the car is to the tracks nats their body camera shows officers digging out rocks so they could",1
413,"was not taken to the hospital breaking news from the capitol---- after a dramatic last minute vote--- the senate ageed to re-open debate on what to do when it comes to health-care three republicans switched their vote to yes at the last minute---- and two republicans voted against the proposal --- splitting the vote 50-50 vice president mike pence cast the tie-breaking vote it's expected the senate will come up with and vote on",1
414,"i'll show you when there's a better chance for rain and cooler weather ahead on the news at nine senator i stand here today looking a little worse for wear i'm sure i have a refreshed appreciation for the protocalsprotocols and customs of this body and for the other 99 privileged souls who've been elected to the senate the old addage if at first you don't succeed try try again playing out in washington the latest on the on- going saga",1
415,"pick-up with new mexico tags contact l-p-d with info especially if you know the theif federal regulators investigating the troubled iowa trucking company linked to the deaths of 10 immigrants found in one of its trailers in",1
416,"company owner says he has no idea that dozens of immigrants were packed into that trailer he claims the company sold the trailer to an individual in mexico and an independent contractor was driving it to brownsville to carry out the sale the schaller iowa-based company has a history of safety and financial problems the driver james matthew bradley jr charged with illegally transporting immigrants for financial gain resulting in death he could face the death penalty if convicted",1
417,"new york suburb the driver of the vehicle and five train passengers were killed the board says the driver moved her vehicle onto the tracks as railroad crossing warnings were activated and gate arms were being lowered the driver then got out of her s-u-v to arm struck her vehicle ááááamandaáááá çááávoáááña u-s navy patrol ship fired warning shots near an iranian vessel that came dangerously close to it in the persian gulf today tuesday in video released by the department of the iranian vessel is sitting directly in front of the",1
418,"directly in front of the uss thunderbolt in bahrain when the iranian vessel approached a spokesman said the iran ship didn't respond to repeated radio calls flares and horn blasts so when it came within 150 yards of the thunderbolt u-s sailors fired warning shots with a",1
419,"at what you're on social media çááácrispináááñ some companies give employees badges or key fobs that allows them access to the office but one wisconsin company is offering it's employees çááávoáááñthree an implant square market is offering its employees a work-issued microchip implant into their skin that will allow them all access all over their",1
421,"clinic check out the story on kkco 11 news dot com çááájeanáááñsince we are talking about that dreaded s word families plan to spend nearly 700 dollars for school supplies mary moloney goes inside the numbers for us çááápkgáááñ back to school shopping plan to open your wallet according to the national retail federation -- families are more confident in the economy this year and will likely spend more money on supplies this year -- families shopping for kids in",1
422,"6 o'clock tomorrow morning for road maintenance the state department of transportation tweeted the closure just before nine tonight çááájeanáááñpresident donald trump held a rally tonight in youngstown ohio the president covered many topics in his one-hour speech and talked about today's senate vote that advanced debate on a new health care bill take care for the american people 21 çááátake sotáááñ president trump we're now one step closer to liberating our citizens from this obamacare nightmare 08 applause cheers 13 and delivering great health care for the american people take vo continues çááávo continuesáááñ çááávoáááñmeanwhile in washington d c the senate judiciary committee has rescinded its subpoena of former trump campaign manager paul manafort to appear at a hearing",1
423,"senate judiciary committee had issued a subpoena for manafort to testify at a hearing tomorrow the panel like the intelligence committee is investigating russian interference in the 2016 election take recused have recused himself 07 çááátake sotáááñ i am disappointed in the attorney general he should not have recused have recused himself çááávo continuesáááñin the rose gardens at the white house president trump stepping to the podium and publicly belittling his attorney general jeff sessions saying time will tell as to whether he will fire him sessions recused himself because he served on the trump campaign the attorney general is showing no signs he's going to step down",1
424,"the real debate healcare begins lawmakers have start a series of dicussions over exaly what the bill will ultimatelyecome í vermont this is the most dangerous and destructive piece of legislation ever to be discussed on the floor of the senate in the modern history of our country a repeal and replace bill was put forward in the senate tonight it had a provision to court conservatives authored by ted cruz and another for moderates worried about medicaid cuts the bill failed to advance by a vote of 43-57 with nine republicans voting against it the senate will resume debating health care first thing tomorrow morning after the vote california senator kamala harris called a bill that would kick 20 million people off health care utterly shameful but urged supporters not to throw up their hands but instead roll up their sleeves to fight it senate judiciary committee the point is that we're willing to give all sorts of accommodations but we can't mess around with back and forth",1
426,"started as 11 different fires but right now the 300 firefighters battling the flames have contained just 5 percent a lack of rain has caused a drought across italy and the vatican is leading efforts to preserve water the vatican shut off water for more than 100 of its historical fountains today they say it's the first time this has happened this decision is very much in line with the pope's thinking on ecology you can't waste and sometimes you have to be willing to make a sacrifice we have very beautiful gardens in the vatican they might not be as green this year but we'll survive",1
427,"watches and warnings pushed right to your phone just search news dot vegas wherever you get your apps pres donald i am very happy to announce with zero of democrats votes the motion to proceed on healthcare has just passed and now we move on to truly great healthcare for the american people i look forward to that this was a big step dave courvoisier senate republicans voted today to advance",1
428,"vote in favor of the senate debate t ike pence casted the tie- breaking vote to make the vote 51-50 the vote came during the return of republican senator john mccain who traveled back to washington today after being diagnosed with a rare brain cancer the gop leadership needs nearly every republican senator on board for any action on health care because they only hold a slim majority the high-stakes vote had been in peril for days democrats are united in their opposition and at least two republicans",1
441,"to mid 90s as drier air moves into the atmosphere we will see the rain chances on the slim side for the rest of the week otherwise it will be hot and muggy highs will be in the low to mid 90s and lows will be in the mid to upper 70s during the hottest part of the day",1
442,"m barbara sinatra frank sinatra's wife and like frank used to say let's all have a drink and be somebody the fourth and final wife of entertainment legend frank sinatra has died barbara sinatra passed away today from natural causes at her home in california the sinatras were married for 22 years until frank's death in 1998",1
443,"donna according to our sister station in memphis----the shooting happened at east arkansas youth services tonight we will update you as soon as we get more information confirmed donna tonight senate republicans are one step closer to erasing the affordable care act today the senate narrowly approved efforts to begin debate on a possible repeal kevin it's a major win for g-o-p leaders -- but not every republican is rejoicing",1
445,"at five joe- this is a significant pretty joe anissa- it's significant enough that arizona senator john mccain was present just days after his brain cancer diagnosis coming up all eyes are on d-c as the senate votes to move ahead on health care legislation aimed at dismantling the obama era healthcare i wanted him dead and now he's gone and i'm ok with it i'm okay with that sophia and a woman accused of drowning her",1
446,"because watson' argued the bill brings up title nine or athletics- the bill should not be discussed on the floor and it says or participation in extra curricular athletic activities members there is nothing at all general or otherwise in the governor's proclamation that addresses participation in extra curricular athletic activities sophia watson was overruled by 'lieutenant governor dan patrick' but the senator appealed that ruling senators voted against watson and moved forward to hear the bill on the senate floor open joe now to a follow up from san antonio joe if convicted- the florida man behind the wheel of a tractor trailer full of undocumented immigrants found in san antonio could face the death penalty or spend the rest of his life in jail 60 year old james bradley junior is charged with knowingly transporting undocumented immigrants bradley denies the allegations saying he didn't know there were people crowded in the back of his truck the",1
447,"company says he had just sold the semi trailor were found in the immigrants he was shocked by the news never in my wildest dreams have i think anything like this would ever happen and i feel sorry for all the victims involved i really am and it's unreal butted to honestly he was a nice guy i mean he seemed like a really nice guy but hindsight's 20 20 joe this isn't bradley's first run-in with the law in 2004 he was arrested in florida for grand theft motor vehicle and for being a fugitive from colorado bradley junior will be appointed two attorneys and a preliminary and detention hearing is scheduled for thursday sophia it's a tragic car crash that shook families across the country an 18 year old has been arrested for driving under the influence- then crashing and killing her 14-year-old sister all of this while livestreaming the entire thing on social media",1
448,"her ride in the first place a warning this next story is difficult to watch abc's maggie rulli has more with her kid sister riding shotgun police say obdulia sanchez went on a drunk driving joyride through central california live streaming the entire thing as they swerve past a black suv her 14 year old sister jacquiline is heard crying out 'she's gonna kill me' police say that's exactly what happened on friday - sanchez began drifting off route 165 - then overcorrected the car tumbling the three girls inside screaming jacquiline is tossed from the vehicle moments later with her sister lying lifeless sanchez is back live streaming again i killed my sister i know i'm going to prison for life alright i understand that this is the last thing i wanted to happen okay she's been charged with gross manslaughter while intoxicated sot - chp it's very disturbing to us because of the callous nature of her actions both leading up to her actions and in the immediate aftermath",1
449,"types of technology increase- we could begin to see more disturbing ways that people use technology when committing crimes sophia a prosecutor in a rural community north of new york is defending a plea deal he made with a woman who drowned her fiance during a kayaking trip i wanted him dead and now he's gone and i'm ok with it i'm okay with that angelika graswald is accused of murdering her fiance so she could collect on his life policy insurance she faced life in prison before she agreed to plead guilty to a lesser charge in exchange for her release in september graswald admitted in court she removed the drain plug from her fiance's kayak and watched him drown",1
450,"under district of columbia code the demonstrations came as the senate voted tuesday to move forward with the republicans' long-promised legislation to repeal and replace the affordable care act the vote highlighted by the return of senator john mccain senator john mccain touched down in washington just in time less than a week after being diagnosed with brain cancer mccain swooping in to cast a critical vote on health care",1
453,"taylor right now senators have not said when a vote on the finished health care bill could take place taylor the u-s is a step closer to imposing new sanctions against russia today the house of representatives overwhelmingly passed the sanctions bill four-hundred-19 to three the plan also includes new sanctions against iran and north korea -- and it gives congress the power to block any effort by the white house to weaken sanctions on russia the senate still needs to approve the plan but passed a previous version of the bill with 97 votes president trump has not indicated whether he",1
454,"run wreck police say at the time of his arrest he was on bail for a seperate burglary charge anissa defense officials say a u-s navy ship fired warning shots at an patrol boat in armed iranian the northern end of the persian gulf according to the officials the iranian boat approached and came within 150 s-s yards of the u- thunderbolt the iranians did not respond to any warnings from t-s ship including radio calls firing of flares and five short blasts from the ship's whistle the navy ship then fired warning shots into the water over concerns about the possibility of a collision the iranian ship ceased its provocative actions but lingered in the area for hours",1
455,"because it's on private property it plans to have a geo-engineer further investigate what's causing the cracks to pop up after a key health care vote senate republicans have officially begun the debate process on a plan to repeal and replace obamacare but",1
